Title,Image,d4r55,rfndt,rsqawe,wii7pd,Field,Text
See translation (English),https://lh5.googleusercontent.com/p/AF1QipMT4HgThjV04yT9eUGuh0toX98bJGbi4HEJ3RXF=w45-h45-p-k-no-rp-br100,MADO,"Bahçelievler Merkez, Kültür Sk. Metroport AVM D:2.Kat, 34580 Bahçelievler/İstanbul- ",2 weeks ago,"Mado fırsatçılıkta hiç  şaşırtmıyor Terasi ticari fırsata çeviren mantık… birde servis açmak deniyor Mado genel merkezine de yazdım umurlarında değil….
Servis yorumlarumlarıda asagıda","<span class=""kvMYJc"" role=""img"" aria-label=""1 star""><span class=""hCCjke vzX5Ic google-symbols NhBTye""></span><span class=""hCCjke google-symbols NhBTye""></span><span class=""hCCjke google-symbols NhBTye""></span><span class=""hCCjke google-symbols NhBTye""></span><span class=""hCCjke google-symbols NhBTye""></span></span><span class=""rsqaWe"">2 weeks ago</span><div class=""Tuisuc""></div>",Hurşit CANLI
See translation (English),https://lh5.googleusercontent.com/p/AF1QipOCCHGUQMZkKEk9Gv8LeosQVkGsFIEgy9SHSdji=w45-h45-p-k-no-rp-br100,Ozsut,"Bahçelievler Merkez, Kültür Sk. No: 1 D:86, 34180 Bahçelievler/İstanbul- ",a month ago,Kasada ki bayan daha terbiyeli olsa boş olunca her. Müşteriden kopartma derdi,"<span class=""kvMYJc"" role=""img"" aria-label=""1 star""><span class=""hCCjke vzX5Ic google-symbols NhBTye""></span><span class=""hCCjke google-symbols NhBTye""></span><span class=""hCCjke google-symbols NhBTye""></span><span class=""hCCjke google-symbols NhBTye""></span><span class=""hCCjke google-symbols NhBTye""></span></span><span class=""rsqaWe"">a month ago</span><div class=""Tuisuc""></div>",Hurşit CANLI
See translation (English),https://lh5.googleusercontent.com/p/AF1QipP_2wRnvDyiXK1BfFI_ulQw9d8wpOE-gNE2EMQO=w45-h45-p-k-no-rp-br100,Gloria Yapı Gayrimenkul,"Yakuplu, 106. Sokak, Ata Cd. No:1, 34009 Beylikdüzü/İstanbul- ",2 months ago,Yalan ilanla sizi davet edip bir şeyler çeviriyorlar,"<span class=""kvMYJc"" role=""img"" aria-label=""1 star""><span class=""hCCjke vzX5Ic google-symbols NhBTye""></span><span class=""hCCjke google-symbols NhBTye""></span><span class=""hCCjke google-symbols NhBTye""></span><span class=""hCCjke google-symbols NhBTye""></span><span class=""hCCjke google-symbols NhBTye""></span></span><span class=""rsqaWe"">2 months ago</span><div class=""Tuisuc""></div>",Hurşit CANLI
See translation (English),https://lh5.googleusercontent.com/p/AF1QipO2PG_9QboRqL3gax0NV-XDuuGoqevCYiGkoGBU=w45-h45-p-k-no-rp-br100,Ikbal,"Ayazağa, Cendere Cad. 109/C, 34396 Sarıyer/İstanbul- ",2 months ago,Yarım saat bekletip bayat  ekmeği bile satan mekan,"<span class=""kvMYJc"" role=""img"" aria-label=""1 star""><span class=""hCCjke vzX5Ic google-symbols NhBTye""></span><span class=""hCCjke google-symbols NhBTye""></span><span class=""hCCjke google-symbols NhBTye""></span><span class=""hCCjke google-symbols NhBTye""></span><span class=""hCCjke google-symbols NhBTye""></span></span><span class=""rsqaWe"">2 months ago</span><div class=""Tuisuc""></div>",Hurşit CANLI
See translation (English),https://lh5.googleusercontent.com/p/AF1QipOOFRlwwux9q3oj2d-Ama4Hj1li2C_EouPv2Ak2=w45-h45-p-k-no-rp-br100,AKDOĞAN PASTA & KEBAP RESTORAN KAHVALTI BAKLAVA,"Halkalı Merkez, Zeynebiye Cd. No:4, 34303 Küçükçekmece/İstanbul- ",3 months ago,"Yemek sonrası çayı Fiyata eklemiş
İkram Kültürü yok sanırım
Her restoran Çayı ikram eder burası satıyor","<span class=""kvMYJc"" role=""img"" aria-label=""1 star""><span class=""hCCjke vzX5Ic google-symbols NhBTye""></span><span class=""hCCjke google-symbols NhBTye""></span><span class=""hCCjke google-symbols NhBTye""></span><span class=""hCCjke google-symbols NhBTye""></span><span class=""hCCjke google-symbols NhBTye""></span></span><span class=""rsqaWe"">3 months ago</span><div class=""Tuisuc""></div>",Hurşit CANLI
,https://lh5.googleusercontent.com/p/AF1QipNXk1JPZyms_9gXncLQccfKfWjAn7RtEGwbT0GV=w45-h45-p-k-no-rp-br100,Nezih Cağ Kebap,"Gez Mahallesi Kombina Cad. No:17 Bostancıoğlu Sitesi Yanı, 25200 Yakutiye/Erzurum- ",4 months ago,,"<span class=""kvMYJc"" role=""img"" aria-label=""5 stars""><span class=""hCCjke vzX5Ic google-symbols NhBTye""></span><span class=""hCCjke vzX5Ic google-symbols NhBTye""></span><span class=""hCCjke vzX5Ic google-symbols NhBTye""></span><span class=""hCCjke vzX5Ic google-symbols NhBTye""></span><span class=""hCCjke vzX5Ic google-symbols NhBTye""></span></span><span class=""rsqaWe"">4 months ago</span><div class=""Tuisuc""></div>",Hurşit CANLI
,https://lh5.googleusercontent.com/p/AF1QipMgchXlkqWUr8D6-HJNEl7iDX43KLxtYh57PKyD=w45-h45-p-k-no-rp-br100,LG Yetkili Servis Merkezi İletişim Destek,"Cebeci, 2460. Sk., 34270 Sultangazi/İstanbul- ",4 months ago,,"<span class=""kvMYJc"" role=""img"" aria-label=""1 star""><span class=""hCCjke vzX5Ic google-symbols NhBTye""></span><span class=""hCCjke google-symbols NhBTye""></span><span class=""hCCjke google-symbols NhBTye""></span><span class=""hCCjke google-symbols NhBTye""></span><span class=""hCCjke google-symbols NhBTye""></span></span><span class=""rsqaWe"">4 months ago</span><div class=""Tuisuc""></div>",Hurşit CANLI
See translation (English),https://lh5.googleusercontent.com/p/AF1QipNdFQmhSoXiaagFsAcV50JeKfSaRf3-RqZfoiCr=w45-h45-p-k-no-rp-br100,Vatan Computer Topkapı,"Merkezefendi, Mevlana Cd. No:138, 34015 Zeytinburnu/İstanbul- ",4 months ago,"Eski Vatan değil mahalle ticaretine dönüştürmüş
En iyi Laptopu verin  sorun olmasın dedim laptop yavaş
Servis zaten çözüm üretmekten aciz","<span class=""kvMYJc"" role=""img"" aria-label=""1 star""><span class=""hCCjke vzX5Ic google-symbols NhBTye""></span><span class=""hCCjke google-symbols NhBTye""></span><span class=""hCCjke google-symbols NhBTye""></span><span class=""hCCjke google-symbols NhBTye""></span><span class=""hCCjke google-symbols NhBTye""></span></span><span class=""rsqaWe"">4 months ago</span><div class=""Tuisuc""></div>",Hurşit CANLI
,https://lh5.googleusercontent.com/p/AF1QipNkj4mQrqX0gCBgv8tGTPREJdRxxxABvtDFyyp0=w45-h45-p-k-no-rp-br100,Siteler Mahallesi Semt Pazarı,"Siteler, 07985 Konyaaltı/Antalya- ",6 months ago,,"<span class=""kvMYJc"" role=""img"" aria-label=""1 star""><span class=""hCCjke vzX5Ic google-symbols NhBTye""></span><span class=""hCCjke google-symbols NhBTye""></span><span class=""hCCjke google-symbols NhBTye""></span><span class=""hCCjke google-symbols NhBTye""></span><span class=""hCCjke google-symbols NhBTye""></span></span><span class=""rsqaWe"">6 months ago</span><div class=""Tuisuc""></div>",Hurşit CANLI
,https://lh5.googleusercontent.com/p/AF1QipPWM81qDD7oqOsgeTZ7vwvqoHTmKni3fMRo5viY=w45-h45-p-k-no-rp-br100,Kapalı Pazar Yeri,"Siteler, 07070 Konyaaltı/Antalya- ",6 months ago,,"<span class=""kvMYJc"" role=""img"" aria-label=""1 star""><span class=""hCCjke vzX5Ic google-symbols NhBTye""></span><span class=""hCCjke google-symbols NhBTye""></span><span class=""hCCjke google-symbols NhBTye""></span><span class=""hCCjke google-symbols NhBTye""></span><span class=""hCCjke google-symbols NhBTye""></span></span><span class=""rsqaWe"">6 months ago</span><div class=""Tuisuc""></div>",Hurşit CANLI
,https://lh5.googleusercontent.com/p/AF1QipPieJFDgnUDCsc_0dgNjHHxzhX1vc92ZPr1-evm=w45-h45-p-k-no-rp-br100,coffee's,"Meltem, Sahil Antalya Yaşam Parkı, Beach Park No: 10/31, 07030 Muratpaşa/Antalya- ",6 months ago,,"<span class=""kvMYJc"" role=""img"" aria-label=""5 stars""><span class=""hCCjke vzX5Ic google-symbols NhBTye""></span><span class=""hCCjke vzX5Ic google-symbols NhBTye""></span><span class=""hCCjke vzX5Ic google-symbols NhBTye""></span><span class=""hCCjke vzX5Ic google-symbols NhBTye""></span><span class=""hCCjke vzX5Ic google-symbols NhBTye""></span></span><span class=""rsqaWe"">6 months ago</span><div class=""Tuisuc""></div>",Hurşit CANLI
,https://lh5.googleusercontent.com/p/AF1QipOZ6qs3RRKYoXd0xelVCwuDnDglYAPJOsxGGLKD=w45-h45-p-k-no-rp-br100,Keçiborlu Otogar,"Hasanbey, 32700 Keçiborlu/Isparta- ",6 months ago,,"<span class=""kvMYJc"" role=""img"" aria-label=""5 stars""><span class=""hCCjke vzX5Ic google-symbols NhBTye""></span><span class=""hCCjke vzX5Ic google-symbols NhBTye""></span><span class=""hCCjke vzX5Ic google-symbols NhBTye""></span><span class=""hCCjke vzX5Ic google-symbols NhBTye""></span><span class=""hCCjke vzX5Ic google-symbols NhBTye""></span></span><span class=""rsqaWe"">6 months ago</span><div class=""Tuisuc""></div>",Hurşit CANLI
,https://lh5.googleusercontent.com/p/AF1QipMZzDUJxZOTLiNNRx8_uOceZK4-ZUzLFOfXYd_W=w45-h45-p-k-no-rp-br100,Süleymaniye Çocuk Parkı,"Süleymaniye, 07630 Akseki/Antalya- ",6 months ago,,"<span class=""kvMYJc"" role=""img"" aria-label=""3 stars""><span class=""hCCjke vzX5Ic google-symbols NhBTye""></span><span class=""hCCjke vzX5Ic google-symbols NhBTye""></span><span class=""hCCjke vzX5Ic google-symbols NhBTye""></span><span class=""hCCjke google-symbols NhBTye""></span><span class=""hCCjke google-symbols NhBTye""></span></span><span class=""rsqaWe"">6 months ago</span><div class=""Tuisuc""></div>",Hurşit CANLI
,https://lh5.googleusercontent.com/p/AF1QipPYX18_iT4yDes8DpyVCJRiytIbJfUqbKz9FKkn=w45-h45-p-k-no-rp-br100,Caglayan Koyu Muhtarligi,66302 Çağlayan/Akdağmadeni/Yozgat- ,6 months ago,,"<span class=""kvMYJc"" role=""img"" aria-label=""5 stars""><span class=""hCCjke vzX5Ic google-symbols NhBTye""></span><span class=""hCCjke vzX5Ic google-symbols NhBTye""></span><span class=""hCCjke vzX5Ic google-symbols NhBTye""></span><span class=""hCCjke vzX5Ic google-symbols NhBTye""></span><span class=""hCCjke vzX5Ic google-symbols NhBTye""></span></span><span class=""rsqaWe"">6 months ago</span><div class=""Tuisuc""></div>",Hurşit CANLI
,https://lh5.googleusercontent.com/p/AF1QipN8xdUVsKeFZwdtmgSGY6t6JRL9-_klcPB3Ze7n=w45-h45-p-k-no-rp-br100,Buuzecedi Restaurant,"Akşemsettin, Akşemsettin Cd. No:23, 34080 Fatih/İstanbul- ",6 months ago,,"<span class=""kvMYJc"" role=""img"" aria-label=""2 stars""><span class=""hCCjke vzX5Ic google-symbols NhBTye""></span><span class=""hCCjke vzX5Ic google-symbols NhBTye""></span><span class=""hCCjke google-symbols NhBTye""></span><span class=""hCCjke google-symbols NhBTye""></span><span class=""hCCjke google-symbols NhBTye""></span></span><span class=""rsqaWe"">6 months ago</span><div class=""Tuisuc""></div>",Hurşit CANLI
,https://lh5.googleusercontent.com/p/AF1QipMBT8j-E2B0hpoLv5MkLQOsc5ZcFRpK0yxaYdAC=w45-h45-p-k-no-rp-br100,Değirmenci Baba Börek&Mantı Konyaaltı,"Altınkum, Karacan Apartmanı, Gazi Mustafa Kemal Blv. No:100 B, 07110 Konyaaltı/Antalya- ",6 months ago,,"<span class=""kvMYJc"" role=""img"" aria-label=""2 stars""><span class=""hCCjke vzX5Ic google-symbols NhBTye""></span><span class=""hCCjke vzX5Ic google-symbols NhBTye""></span><span class=""hCCjke google-symbols NhBTye""></span><span class=""hCCjke google-symbols NhBTye""></span><span class=""hCCjke google-symbols NhBTye""></span></span><span class=""rsqaWe"">6 months ago</span><div class=""Tuisuc""></div>",Hurşit CANLI
,https://lh5.googleusercontent.com/p/AF1QipNAs7WKbqEMiKSLLdMDqhSCzx5bUKzf1xS9k09x=w45-h45-p-k-no-rp-br100,Omer Duruk Dinlenme Tesisleri,"Büyükalan, Antalya Konya Yolu Üzeri No:151, 07630 Akseki/Antalya- ",6 months ago,,"<span class=""kvMYJc"" role=""img"" aria-label=""3 stars""><span class=""hCCjke vzX5Ic google-symbols NhBTye""></span><span class=""hCCjke vzX5Ic google-symbols NhBTye""></span><span class=""hCCjke vzX5Ic google-symbols NhBTye""></span><span class=""hCCjke google-symbols NhBTye""></span><span class=""hCCjke google-symbols NhBTye""></span></span><span class=""rsqaWe"">6 months ago</span><div class=""Tuisuc""></div>",Hurşit CANLI
,https://lh5.googleusercontent.com/p/AF1QipOMiSLe8Rb9tese9IUvciZgubbS6KYY3DgSQfqB=w45-h45-p-k-no-rp-br100,Artezyen et mangal,"Sanayi, Konya Manavgat Yolu No:7800, 07600 Manavgat/Antalya- ",6 months ago,,"<span class=""kvMYJc"" role=""img"" aria-label=""5 stars""><span class=""hCCjke vzX5Ic google-symbols NhBTye""></span><span class=""hCCjke vzX5Ic google-symbols NhBTye""></span><span class=""hCCjke vzX5Ic google-symbols NhBTye""></span><span class=""hCCjke vzX5Ic google-symbols NhBTye""></span><span class=""hCCjke vzX5Ic google-symbols NhBTye""></span></span><span class=""rsqaWe"">6 months ago</span><div class=""Tuisuc""></div>",Hurşit CANLI
,https://lh5.googleusercontent.com/p/AF1QipOQjetuD_y_5gX7PNvbJxdrxijcqTefmnnwZ3Zs=w45-h45-p-k-no-rp-br100,Birtat Donas Hatay Usulü Döner,"Kayalıyokuş, Belediye Sitesi, Cumhuriyet Cd No:9/D, 58400 Şarkışla/Sivas- ",6 months ago,,"<span class=""kvMYJc"" role=""img"" aria-label=""5 stars""><span class=""hCCjke vzX5Ic google-symbols NhBTye""></span><span class=""hCCjke vzX5Ic google-symbols NhBTye""></span><span class=""hCCjke vzX5Ic google-symbols NhBTye""></span><span class=""hCCjke vzX5Ic google-symbols NhBTye""></span><span class=""hCCjke vzX5Ic google-symbols NhBTye""></span></span><span class=""rsqaWe"">6 months ago</span><div class=""Tuisuc""></div>",Hurşit CANLI
See translation (English),https://lh5.googleusercontent.com/p/AF1QipOuwCY9bBHTR-QJEExQDbJfQbo0Pwug5Yogf3Vj=w45-h45-p-k-no-rp-br100,Hacıbey,"Borazanlar mahallesi Mehmet Akif Ersoy Bulvarı Kanca Apartmanı A blok 13, D:9, 14000 Merkez/Bolu- ",7 months ago,Gerçek lezzet ve kaliteli ustalar,"<span class=""kvMYJc"" role=""img"" aria-label=""5 stars""><span class=""hCCjke vzX5Ic google-symbols NhBTye""></span><span class=""hCCjke vzX5Ic google-symbols NhBTye""></span><span class=""hCCjke vzX5Ic google-symbols NhBTye""></span><span class=""hCCjke vzX5Ic google-symbols NhBTye""></span><span class=""hCCjke vzX5Ic google-symbols NhBTye""></span></span><span class=""rsqaWe"">7 months ago</span><div class=""Tuisuc""></div>",Hurşit CANLI
See translation (English),https://lh5.googleusercontent.com/p/AF1QipO_exCNVbpiB3COci4tMGjmRqhquxDO8SuSJZj1=w45-h45-p-k-no-rp-br100,Urfali Kebapci,"Ostim, Mehmet Akif Ersoy Cd. No:41, 06374 Yenimahalle/Ankara- ",7 months ago,Temiz leziz ve kaaliteli,"<span class=""kvMYJc"" role=""img"" aria-label=""5 stars""><span class=""hCCjke vzX5Ic google-symbols NhBTye""></span><span class=""hCCjke vzX5Ic google-symbols NhBTye""></span><span class=""hCCjke vzX5Ic google-symbols NhBTye""></span><span class=""hCCjke vzX5Ic google-symbols NhBTye""></span><span class=""hCCjke vzX5Ic google-symbols NhBTye""></span></span><span class=""rsqaWe"">7 months ago</span><div class=""Tuisuc""></div>",Hurşit CANLI
,https://lh5.googleusercontent.com/p/AF1QipMxxYNWQIHvrZk76xiuCNtwqzzci87wAGY7oIWI=w45-h45-p-k-no-rp-br100,"Crowne Plaza Antalya, an IHG Hotel","Gürsu, Akdeniz Blv. 304. Sokak, 07070 Konyaaltı/Antalya- ",7 months ago,,"<span class=""kvMYJc"" role=""img"" aria-label=""5 stars""><span class=""hCCjke vzX5Ic google-symbols NhBTye""></span><span class=""hCCjke vzX5Ic google-symbols NhBTye""></span><span class=""hCCjke vzX5Ic google-symbols NhBTye""></span><span class=""hCCjke vzX5Ic google-symbols NhBTye""></span><span class=""hCCjke vzX5Ic google-symbols NhBTye""></span></span><span class=""rsqaWe"">7 months ago</span><div class=""Tuisuc""></div>",Hurşit CANLI
,https://lh5.googleusercontent.com/p/AF1QipPts6odBr9-f8EO7oOmSxs2osKVpHA35WHDR9AJ=w45-h45-p-k-no-rp-br100,Hafız Mustafa 1864 Pera,"Kuloğlu, İstiklal Cd. No:121, 34433 Beyoğlu/İstanbul- ",7 months ago,,"<span class=""kvMYJc"" role=""img"" aria-label=""5 stars""><span class=""hCCjke vzX5Ic google-symbols NhBTye""></span><span class=""hCCjke vzX5Ic google-symbols NhBTye""></span><span class=""hCCjke vzX5Ic google-symbols NhBTye""></span><span class=""hCCjke vzX5Ic google-symbols NhBTye""></span><span class=""hCCjke vzX5Ic google-symbols NhBTye""></span></span><span class=""rsqaWe"">7 months ago</span><div class=""Tuisuc""></div>",Hurşit CANLI
,https://lh5.googleusercontent.com/p/AF1QipNkoFcoE1gZKgmh9nuZpJRR-o5H6rp2hmcxZ2Qw=w45-h45-p-k-no-rp-br100,İBB Florya Sosyal Tesisleri,"İtfaiye Cad. No:1 Yeşilköy Halk Pazarı Yanı Yeşilköy İtfaye Arkası Florya, 34153 Bakırköy/İstanbul- ",7 months ago,,"<span class=""kvMYJc"" role=""img"" aria-label=""5 stars""><span class=""hCCjke vzX5Ic google-symbols NhBTye""></span><span class=""hCCjke vzX5Ic google-symbols NhBTye""></span><span class=""hCCjke vzX5Ic google-symbols NhBTye""></span><span class=""hCCjke vzX5Ic google-symbols NhBTye""></span><span class=""hCCjke vzX5Ic google-symbols NhBTye""></span></span><span class=""rsqaWe"">7 months ago</span><div class=""Tuisuc""></div>",Hurşit CANLI
,https://lh5.googleusercontent.com/p/AF1QipP9aRMFC4GYtkRudK2mSp_qCN55Gf4U9FHExlqA=w45-h45-p-k-no-rp-br100,Otel Akpınar,"Eskibağlar, Kumlubel Sk. No:20, 26170 Tepebaşı/Eskişehir- ",7 months ago,,"<span class=""kvMYJc"" role=""img"" aria-label=""5 stars""><span class=""hCCjke vzX5Ic google-symbols NhBTye""></span><span class=""hCCjke vzX5Ic google-symbols NhBTye""></span><span class=""hCCjke vzX5Ic google-symbols NhBTye""></span><span class=""hCCjke vzX5Ic google-symbols NhBTye""></span><span class=""hCCjke vzX5Ic google-symbols NhBTye""></span></span><span class=""rsqaWe"">7 months ago</span><div class=""Tuisuc""></div>",Hurşit CANLI
See translation (English),https://lh5.googleusercontent.com/p/AF1QipMkb3UtOF5h9KIgaCJ40dnKZ38aNUx-5eqlc-Hj=w45-h45-p-k-no-rp-br100,Kent Meydanı Konyaaltı,"Altınkum, Akdeniz Blv. 176 C, 07070 Konyaaltı/Antalya- ",7 months ago,Antalya’nın göz bebeği,"<span class=""kvMYJc"" role=""img"" aria-label=""5 stars""><span class=""hCCjke vzX5Ic google-symbols NhBTye""></span><span class=""hCCjke vzX5Ic google-symbols NhBTye""></span><span class=""hCCjke vzX5Ic google-symbols NhBTye""></span><span class=""hCCjke vzX5Ic google-symbols NhBTye""></span><span class=""hCCjke vzX5Ic google-symbols NhBTye""></span></span><span class=""rsqaWe"">7 months ago</span><div class=""Tuisuc""></div>",Hurşit CANLI
,https://lh5.googleusercontent.com/p/AF1QipMvBo4oOAuHPg4a1h64QYm0AKWlkxMSN-uynv_X=w45-h45-p-k-no-rp-br100,Dilek Pastanesi Zuhuratbaba,"Zuhuratbaba, İncirli Cd. No:41 D:41, 34147 Bakırköy/İstanbul- ",7 months ago,,"<span class=""kvMYJc"" role=""img"" aria-label=""5 stars""><span class=""hCCjke vzX5Ic google-symbols NhBTye""></span><span class=""hCCjke vzX5Ic google-symbols NhBTye""></span><span class=""hCCjke vzX5Ic google-symbols NhBTye""></span><span class=""hCCjke vzX5Ic google-symbols NhBTye""></span><span class=""hCCjke vzX5Ic google-symbols NhBTye""></span></span><span class=""rsqaWe"">7 months ago</span><div class=""Tuisuc""></div>",Hurşit CANLI
See translation (English),https://maps.gstatic.com/mapsactivities/icons/poi_icons/mobile/0/xhdpi/lodging_visited.png,İstanbul Özel Yozgat Erkek Öğrenci Yurdu,"Yavuz Sultan Selim, Hanedan Sk. No:15, 34083 Fatih/İstanbul- ",7 months ago,Tertemiz bir yurt,"<span class=""kvMYJc"" role=""img"" aria-label=""5 stars""><span class=""hCCjke vzX5Ic google-symbols NhBTye""></span><span class=""hCCjke vzX5Ic google-symbols NhBTye""></span><span class=""hCCjke vzX5Ic google-symbols NhBTye""></span><span class=""hCCjke vzX5Ic google-symbols NhBTye""></span><span class=""hCCjke vzX5Ic google-symbols NhBTye""></span></span><span class=""rsqaWe"">7 months ago</span><div class=""Tuisuc""></div>",Hurşit CANLI
See translation (English),https://lh5.googleusercontent.com/p/AF1QipPPp3TB-S99z8OyA7IA1uE-JXB1Sy5zPBjXkK3N=w45-h45-p-k-no-rp-br100,Mado Beach Park Konyaaltı Sahil,"Meltem, VARYANT TİC. ÜNİTELER, Akdeniz Blv. NO:10/1, 07100 Muratpaşa/Antalya- ",7 months ago,Nezih ortam,"<span class=""kvMYJc"" role=""img"" aria-label=""5 stars""><span class=""hCCjke vzX5Ic google-symbols NhBTye""></span><span class=""hCCjke vzX5Ic google-symbols NhBTye""></span><span class=""hCCjke vzX5Ic google-symbols NhBTye""></span><span class=""hCCjke vzX5Ic google-symbols NhBTye""></span><span class=""hCCjke vzX5Ic google-symbols NhBTye""></span></span><span class=""rsqaWe"">7 months ago</span><div class=""Tuisuc""></div>",Hurşit CANLI
,https://lh5.googleusercontent.com/p/AF1QipOZ50aj9B_YXfRBYIsMooPFL_naDjEoKEV9F91W=w45-h45-p-k-no-rp-br100,Köfteci Yusuf,"Bağdat, Uşak Cd. No:6/1, 03852 Akören/Hocalar/Afyonkarahisar- ",7 months ago,,"<span class=""kvMYJc"" role=""img"" aria-label=""4 stars""><span class=""hCCjke vzX5Ic google-symbols NhBTye""></span><span class=""hCCjke vzX5Ic google-symbols NhBTye""></span><span class=""hCCjke vzX5Ic google-symbols NhBTye""></span><span class=""hCCjke vzX5Ic google-symbols NhBTye""></span><span class=""hCCjke google-symbols NhBTye""></span></span><span class=""rsqaWe"">7 months ago</span><div class=""Tuisuc""></div>",Hurşit CANLI
See translation (English),https://lh5.googleusercontent.com/p/AF1QipMC1jPYj8l1mx9gLQ0C6R6IRzmoMEotOXGs4FVZ=w45-h45-p-k-no-rp-br100,Shell,"Hürriyet Caddesi ADA:-,PAF:-,PARS:, D:268, 07220 Kepez- ",a week ago,Valla genelde sehir ici  petroller  cok fazla kullabildiğindan wcleri  inanilmaz kötü olur. Ama burasi su geldiğim zaman diliminde gercekten evimdeki wc gibiydi. Bir petrolü petrol yapan wcsidir  Ee ne demisler Aklı kelden benzini shell den alcan,"<span class=""kvMYJc"" role=""img"" aria-label=""5 stars""><span class=""hCCjke vzX5Ic google-symbols NhBTye""></span><span class=""hCCjke vzX5Ic google-symbols NhBTye""></span><span class=""hCCjke vzX5Ic google-symbols NhBTye""></span><span class=""hCCjke vzX5Ic google-symbols NhBTye""></span><span class=""hCCjke vzX5Ic google-symbols NhBTye""></span></span><span class=""rsqaWe"">a week ago</span><div class=""Tuisuc""></div>",Nurullah Uzun
See translation (English),https://lh5.googleusercontent.com/p/AF1QipNZ8KEvKnACnI0vOMAMuRUE3f1CtEq5y6MIJ94_=w45-h45-p-k-no-rp-br100,Neşeli Balık,"Eski, 108. Sk., 07740 Finike/Antalya- ",4 months ago,Calisan arkadaslarin bizimle ilgilenirken ki mutluluğu başka bir güzellik,"<span class=""kvMYJc"" role=""img"" aria-label=""5 stars""><span class=""hCCjke vzX5Ic google-symbols NhBTye""></span><span class=""hCCjke vzX5Ic google-symbols NhBTye""></span><span class=""hCCjke vzX5Ic google-symbols NhBTye""></span><span class=""hCCjke vzX5Ic google-symbols NhBTye""></span><span class=""hCCjke vzX5Ic google-symbols NhBTye""></span></span><span class=""rsqaWe"">4 months ago</span><div class=""Tuisuc""></div>",Nurullah Uzun
See translation (English),https://lh5.googleusercontent.com/p/AF1QipOM6fkalRhdqW6yUMpx4xjBAiBxX6rWf-3Pk0JT=w45-h45-p-k-no-rp-br100,Kutupayısı Genel Merkez,"Yenibosna Merkez Mah., Selim Ayaydın Cad Hasan Tanık İş Merkezi D:2, 34197 Yenibosna/İstanbul- ",6 months ago,36 yaşındayım şimdiye kadar bir ürününün arkasında bu kadar kaliteli duran bir firma görmedim... İnternetden stanley marka bi termos aldım. Yıkarken küçük bir contasını kaybetmişim. İnternetden iletişim numarasını bulup problemi whatsaap …,"<span class=""kvMYJc"" role=""img"" aria-label=""5 stars""><span class=""hCCjke vzX5Ic google-symbols NhBTye""></span><span class=""hCCjke vzX5Ic google-symbols NhBTye""></span><span class=""hCCjke vzX5Ic google-symbols NhBTye""></span><span class=""hCCjke vzX5Ic google-symbols NhBTye""></span><span class=""hCCjke vzX5Ic google-symbols NhBTye""></span></span><span class=""rsqaWe"">6 months ago</span><div class=""Tuisuc""></div>",Nurullah Uzun
See translation (English),https://lh5.googleusercontent.com/p/AF1QipPmPiv788qBbdbebL-ZBeEbdllCP3CvR8aUDo0-=w45-h45-p-k-no-rp-br100,Milklaç - Burhanettin Onat,"Zerdalilik, Burhanettin Onat Cd. Altındal apt D:88/A, 07007 Muratpaşa/Antalya- ",6 months ago,Tatlılar çok hafif bayıldık. Zeynep hanim cok nazik emeği geçen herkese teşekkürler,"<span class=""kvMYJc"" role=""img"" aria-label=""5 stars""><span class=""hCCjke vzX5Ic google-symbols NhBTye""></span><span class=""hCCjke vzX5Ic google-symbols NhBTye""></span><span class=""hCCjke vzX5Ic google-symbols NhBTye""></span><span class=""hCCjke vzX5Ic google-symbols NhBTye""></span><span class=""hCCjke vzX5Ic google-symbols NhBTye""></span></span><span class=""rsqaWe"">6 months ago</span><div class=""Tuisuc""></div>",Nurullah Uzun
,https://lh5.googleusercontent.com/p/AF1QipORG3iJ3azpzXq9Ox7ZdhJJb2PhTmA_TsrAze1d=w45-h45-p-k-no-rp-br100,Alp Paşa Boutique Hotel,"Barbaros, Hesapçı Sk. No: 30, 07100 Muratpaşa/Antalya- ",a year ago,,"<span class=""kvMYJc"" role=""img"" aria-label=""5 stars""><span class=""hCCjke vzX5Ic google-symbols NhBTye""></span><span class=""hCCjke vzX5Ic google-symbols NhBTye""></span><span class=""hCCjke vzX5Ic google-symbols NhBTye""></span><span class=""hCCjke vzX5Ic google-symbols NhBTye""></span><span class=""hCCjke vzX5Ic google-symbols NhBTye""></span></span><span class=""rsqaWe"">a year ago</span><div class=""Tuisuc""></div>",Nurullah Uzun
See translation (English),https://lh5.googleusercontent.com/p/AF1QipMvWP7DGHqQfUrOlSP9rnNGGE2B1mxIkIoPr2zC=w45-h45-p-k-no-rp-br100,Deniz simit bakery,"Kültür, 3805. Sk. No:44 D:b, 07090 Kepez/Antalya- ",a year ago,Güzel yiyecek şeyler bulduk 😉,"<span class=""kvMYJc"" role=""img"" aria-label=""5 stars""><span class=""hCCjke vzX5Ic google-symbols NhBTye""></span><span class=""hCCjke vzX5Ic google-symbols NhBTye""></span><span class=""hCCjke vzX5Ic google-symbols NhBTye""></span><span class=""hCCjke vzX5Ic google-symbols NhBTye""></span><span class=""hCCjke vzX5Ic google-symbols NhBTye""></span></span><span class=""rsqaWe"">a year ago</span><div class=""Tuisuc""></div>",Nurullah Uzun
